{
  "$schema": "https://json-schema.org/draft/2020-12/schema",
  "$id": "hermes-gis-canvas/canvas/v1",
  "title": "GIS Canvas Document v1",
  "type": "object",
  "required": ["canvasVersion", "layout", "components"],
  "additionalProperties": false,
  "properties": {
    "canvasVersion": { "const": 1 },
    "rev": { "type": "integer", "minimum": 0 },
    "layout": {
      "type": "object",
      "required": ["type", "cols"],
      "additionalProperties": false,
      "properties": {
        "type": { "const": "grid" },
        "cols": { "type": "integer", "minimum": 1, "maximum": 24 },
        "rowHeight": { "type": "integer", "minimum": 20, "maximum": 400 },
        "gap": { "type": "integer", "minimum": 0, "maximum": 64 }
      }
    },
    "components": { "type": "array", "items": { "$ref": "#/$defs/componentNode" } },
    "overlays": { "type": "array", "items": { "$ref": "#/$defs/componentNode" } },
    "focus": { "type": "string" }
  },
  "$defs": {
    "area": {
      "type": "object",
      "required": ["col", "colSpan", "row", "rowSpan"],
      "additionalProperties": false,
      "properties": {
        "col": { "type": "integer", "minimum": 1 },
        "colSpan": { "type": "integer", "minimum": 1 },
        "row": { "type": "integer", "minimum": 1 },
        "rowSpan": { "type": "integer", "minimum": 1 }
      }
    },
    "componentNode": {
      "type": "object",
      "required": ["id", "type"],
      "additionalProperties": false,
      "properties": {
        "id": { "type": "string", "pattern": "^[a-zA-Z][a-zA-Z0-9_-]{0,63}$" },
        "type": { "enum": ["card", "stat", "data-table", "select", "tabs", "esri:map", "esri:legend", "esri:feature-table"] },
        "area": { "$ref": "#/$defs/area" },
        "layer": { "enum": ["base", "dock", "float"] },
        "edge": { "enum": ["left", "right", "top", "bottom"] },
        "anchor": { "enum": ["top-left", "top", "top-right", "left", "center", "right", "bottom-left", "bottom", "bottom-right"] },
        "size": {
          "type": "object",
          "additionalProperties": false,
          "required": ["w", "h"],
          "properties": {
            "w": { "type": "number", "minimum": 0, "maximum": 100 },
            "h": { "type": "number", "minimum": 0, "maximum": 100 }
          }
        },
        "z": { "type": "integer" },
        "props": { "type": "object" },
        "bindings": {
          "type": "object",
          "additionalProperties": {
            "anyOf": [ { "type": "string" }, { "type": "array", "items": { "type": "string" } } ]
          }
        },
        "state": { "type": "object" },
        "children": { "type": "array", "items": { "$ref": "#/$defs/componentNode" } },
        "slots": {
          "type": "object",
          "additionalProperties": { "type": "array", "items": { "$ref": "#/$defs/componentNode" } }
        },
        "handlers": {
          "type": "object",
          "additionalProperties": {
            "type": "object",
            "required": ["kind"],
            "properties": {
              "kind": { "enum": ["set", "reactive", "open", "agent"] },
              "target": { "type": "string" },
              "key": { "type": "string" },
              "value": {},
              "controls": { "type": "string" },
              "overlay": { "type": "string" },
              "prompt": { "type": "string" }
            },
            "allOf": [
              { "if": { "properties": { "kind": { "const": "reactive" } } }, "then": { "required": ["controls"] } },
              { "if": { "properties": { "kind": { "const": "set" } } }, "then": { "required": ["target", "key"] } },
              { "if": { "properties": { "kind": { "const": "agent" } } }, "then": { "required": ["prompt"] } },
              { "if": { "properties": { "kind": { "const": "open" } } }, "then": { "required": ["overlay"] } }
            ]
          }
        }
      }
    }
  }
}
